{
  "$schema": "https://json-schema.org/draft/2020-12/schema",
  "$id": "https://prus.dev/contracts/category.v1.schema.json",
  "title": "Category contract v1",
  "type": "object",
  "additionalProperties": false,
  "required": ["contract", "version", "data", "meta"],
  "properties": {
    "contract": {
      "const": "category"
    },
    "version": {
      "type": "string",
      "pattern": "^v1(\\.\\d+)?$"
    },
    "data": {
      "type": "object",
      "additionalProperties": false,
      "properties": {
        "item": {
          "$ref": "#/$defs/category"
        },
        "items": {
          "type": "array",
          "items": {
            "$ref": "#/$defs/category"
          }
        }
      },
      "anyOf": [
        {
          "required": ["item"]
        },
        {
          "required": ["items"]
        }
      ]
    },
    "meta": {
      "type": "object",
      "additionalProperties": true,
      "properties": {
        "total": {
          "type": ["integer", "null"],
          "minimum": 0
        }
      }
    }
  },
  "$defs": {
    "category": {
      "type": "object",
      "additionalProperties": false,
      "required": ["id", "slug", "name", "links"],
      "properties": {
        "id": {
          "type": "integer"
        },
        "slug": {
          "type": "string"
        },
        "name": {
          "type": "string"
        },
        "description": {
          "type": ["string", "null"]
        },
        "parent": {
          "type": ["object", "null"],
          "additionalProperties": false,
          "required": ["id", "slug", "name"],
          "properties": {
            "id": {
              "type": "integer"
            },
            "slug": {
              "type": "string"
            },
            "name": {
              "type": "string"
            }
          }
        },
        "children": {
          "type": "array",
          "items": {
            "$ref": "#/$defs/category"
          }
        },
        "product_count": {
          "type": ["integer", "null"],
          "minimum": 0
        },
        "links": {
          "type": "object",
          "additionalProperties": false,
          "required": ["self"],
          "properties": {
            "self": {
              "type": "string",
              "format": "uri"
            }
          }
        }
      }
    }
  }
}
